{
  "schema": "JungialSaveGame",
  "version": 1,
  "savedAt": "2060-01-01T00:00:04.000Z",
  "migrations": [],
  "payload": {
    "room": {
      "note": "the word",
      "awakened": true,
      "boundaryState": "boundless",
      "portalOpen": true,
      "heartlight": {
        "awake": true,
        "intensity": 1,
        "color": "pearl-gold placeholder"
      },
      "visibleToolSigils": [
        {
          "id": "key_of_portals",
          "name": "Key of Portals",
          "effect": "opens_dream_transition"
        },
        {
          "id": "glyph_quill",
          "name": "Glyph Quill",
          "effect": "writes_journal_placeholder"
        },
        {
          "id": "mirror_lens",
          "name": "Mirror Lens",
          "effect": "changes_visual_mood"
        },
        {
          "id": "lamp_of_forms",
          "name": "Lamp of Forms",
          "effect": "spawns_forms_lights_mirrors"
        }
      ],
      "spawnedForms": []
    },
    "archetypeState": {
      "archetype_vector": {
        "Hero": 0.15,
        "Shadow": 0,
        "Anima": 0.1,
        "Animus": 0,
        "Sage": 0.25,
        "Trickster": 0,
        "Creator": 2.15,
        "Destroyer": 0,
        "Child": 0.15,
        "Mother": 0,
        "Father": 0,
        "Lover": 0,
        "Seeker": 2.7499999999999996
      },
      "coherence": 0.578,
      "vibe_state": "silent",
      "symbol_hits": {
        "threshold": 1,
        "silence": 1,
        "light": 2,
        "awakening": 1,
        "portal": 1
      },
      "speech_events": [
        {
          "text": "the word",
          "symbols": [
            "threshold",
            "silence",
            "light"
          ],
          "timestamp": "2060-01-01T00:00:00.000Z"
        }
      ],
      "action_events": [
        {
          "name": "awaken_heartlight",
          "archetypes": [
            "Creator",
            "Seeker"
          ],
          "symbols": [
            "awakening",
            "light"
          ],
          "timestamp": "2060-01-01T00:00:01.000Z"
        },
        {
          "name": "open_portal",
          "archetypes": [
            "Seeker"
          ],
          "symbols": [
            "portal"
          ],
          "timestamp": "2060-01-01T00:00:02.000Z"
        }
      ],
      "room_config_snapshot": {
        "note": "the word",
        "awakened": true,
        "boundaryState": "boundless",
        "portalOpen": false,
        "heartlight": {
          "awake": true,
          "intensity": 1,
          "color": "pearl-gold placeholder"
        },
        "visibleToolSigils": [
          {
            "id": "key_of_portals",
            "name": "Key of Portals",
            "effect": "opens_dream_transition"
          },
          {
            "id": "glyph_quill",
            "name": "Glyph Quill",
            "effect": "writes_journal_placeholder"
          },
          {
            "id": "mirror_lens",
            "name": "Mirror Lens",
            "effect": "changes_visual_mood"
          },
          {
            "id": "lamp_of_forms",
            "name": "Lamp of Forms",
            "effect": "spawns_forms_lights_mirrors"
          }
        ],
        "spawnedForms": []
      }
    },
    "feelingState": {
      "axes": {
        "calm_tense": -0.2,
        "hopeful_melancholic": 0.25,
        "expansive_confined": 0.7,
        "bright_dark": 0.55,
        "warm_cold": -0.25
      },
      "vibe_state": "calm_hopeful_boundless_bright_warm"
    },
    "journal": {
      "entries": [
        {
          "id": "journal_001",
          "title": "Mirror 1",
          "symbols": [
            "boundlessness",
            "dissolution",
            "silence",
            "annihilation",
            "rebirth",
            "cosmic mystery"
          ],
          "actions": [
            "awaken_heartlight",
            "open_portal"
          ],
          "dominantArchetype": "Seeker",
          "vibeState": "calm_hopeful_boundless_bright_warm",
          "text": "I returned with boundlessness, dissolution, silence, annihilation. The Seeker current moved beneath awaken_heartlight, open_portal. The room remembered me as calm_hopeful_boundless_bright_warm. entry, pressure, mirror, return folded into one path.",
          "createdAt": "2060-01-01T00:00:03.000Z"
        }
      ],
      "lexiconOfSymbols": {
        "boundlessness": {
          "symbol": "boundlessness",
          "sightings": 1,
          "note": "Meaning waits for repetition."
        },
        "dissolution": {
          "symbol": "dissolution",
          "sightings": 1,
          "note": "Meaning waits for repetition."
        },
        "silence": {
          "symbol": "silence",
          "sightings": 1,
          "note": "Meaning waits for repetition."
        },
        "annihilation": {
          "symbol": "annihilation",
          "sightings": 1,
          "note": "Meaning waits for repetition."
        },
        "rebirth": {
          "symbol": "rebirth",
          "sightings": 1,
          "note": "Meaning waits for repetition."
        },
        "cosmic mystery": {
          "symbol": "cosmic mystery",
          "sightings": 1,
          "note": "Meaning waits for repetition."
        }
      },
      "playerNotes": [],
      "unlockedBooks": []
    },
    "architectState": {
      "globalDreamWeights": {
        "white_void": 1.561
      },
      "symbolFrequency": {
        "light": 2,
        "threshold": 1,
        "silence": 1,
        "awakening": 1,
        "portal": 1
      },
      "pacingProfile": {
        "intensity": 0.358,
        "repetition": 0.12,
        "silence": 0.61
      },
      "futureDreamModuleWeights": {
        "symbol:boundlessness": 1.1,
        "symbol:dissolution": 1.1,
        "symbol:silence": 1.1
      },
      "maskPressure": {
        "double": 0.294
      }
    },
    "dreamJourney": {
      "schema": "DreamJourneyV1",
      "beats": [
        {
          "role": "entry",
          "moduleId": "white_void",
          "moduleName": "Boundless White Void",
          "symbolicTags": [
            "boundlessness",
            "dissolution",
            "silence"
          ],
          "weightBreakdown": {
            "base": 1,
            "archetype": 2.69,
            "vibe": 1.005,
            "room": 0.25,
            "portal": 0.35,
            "directorMultiplier": 1.1,
            "total": 5.824,
            "roll": 9.3456
          }
        },
        {
          "role": "pressure",
          "moduleId": "space_black_hole",
          "moduleName": "Space / Black Hole",
          "symbolicTags": [
            "annihilation",
            "rebirth",
            "cosmic mystery"
          ],
          "weightBreakdown": {
            "base": 1,
            "archetype": 2.325,
            "vibe": -0.038,
            "room": 0.25,
            "portal": 0.35,
            "directorMultiplier": 1.2,
            "total": 4.665,
            "roll": 13.14156
          }
        },
        {
          "role": "mirror",
          "moduleId": "space_black_hole",
          "moduleName": "Space / Black Hole",
          "symbolicTags": [
            "annihilation",
            "rebirth",
            "cosmic mystery"
          ],
          "weightBreakdown": {
            "base": 1,
            "archetype": 2.325,
            "vibe": -0.038,
            "room": 0.25,
            "portal": 0.35,
            "directorMultiplier": 1.2,
            "total": 4.665,
            "roll": 14.57627
          }
        },
        {
          "role": "return",
          "moduleId": "white_void",
          "moduleName": "Boundless White Void",
          "symbolicTags": [
            "boundlessness",
            "dissolution",
            "silence"
          ],
          "weightBreakdown": {
            "base": 1,
            "archetype": 2.69,
            "vibe": 1.005,
            "room": 0.25,
            "portal": 0.35,
            "directorMultiplier": 1.1,
            "total": 5.824,
            "roll": 7.47346
          }
        }
      ],
      "symbolTrail": [
        "boundlessness",
        "dissolution",
        "silence",
        "annihilation",
        "rebirth",
        "cosmic mystery"
      ],
      "summary": "entry:Boundless White Void -> pressure:Space / Black Hole -> mirror:Space / Black Hole -> return:Boundless White Void"
    },
    "symbolGrammar": {
      "schema": "SymbolGrammarSnapshotV1",
      "schemaVersion": 1,
      "recurrence": {
        "boundlessness": 1,
        "dissolution": 1,
        "silence": 1,
        "annihilation": 1,
        "rebirth": 1,
        "cosmic mystery": 1
      },
      "symbolicTension": 0,
      "contradictions": [],
      "echoes": []
    },
    "thresholdPresentation": {
      "schema": "ThresholdPresentationV1",
      "room": {
        "awakened": true,
        "boundaryState": "boundless",
        "atmosphereState": "calm_hopeful_boundless_bright_warm"
      },
      "note": {
        "text": "the word",
        "visible": true,
        "material": "ink_warmed_by_heartlight"
      },
      "heartlight": {
        "awake": true,
        "intensity": 1,
        "color": "pearl-gold placeholder",
        "bloom": 0.815
      },
      "portal": {
        "open": true,
        "material": "threshold_rim_light"
      },
      "toolSigils": {
        "visible": [
          {
            "id": "key_of_portals",
            "name": "Key of Portals",
            "effect": "opens_dream_transition",
            "material": "key_of_portals_sigil_placeholder"
          },
          {
            "id": "glyph_quill",
            "name": "Glyph Quill",
            "effect": "writes_journal_placeholder",
            "material": "glyph_quill_sigil_placeholder"
          },
          {
            "id": "mirror_lens",
            "name": "Mirror Lens",
            "effect": "changes_visual_mood",
            "material": "mirror_lens_sigil_placeholder"
          },
          {